{
  "contract": "mreader.ownership-routes",
  "version": 1,
  "generated_from": {
    "route_coverage": "tests/api/endpoint_coverage.tsv",
    "user_gateway": "deploy/docker-desktop-hybrid/Caddyfile.user",
    "admin_gateway": "deploy/docker-desktop-hybrid/Caddyfile.admin"
  },
  "routes": [
    {
      "operation": "catalog.delete.api-catalog-admin-announcements-id",
      "method": "DELETE",
      "path": "/api/catalog/admin/announcements/{id}",
      "lifecycle": "current",
      "access_plane": "admin",
      "owner": "catalog",
      "handler": "services/catalog_go/internal/httpapi/api.go:a.deleteAnnouncement",
      "version": "v1",
      "authentication": {
        "mode": "admin-session",
        "principal": "admin",
        "required_role": "admin",
        "credential_scope": null
      },
      "permitted_writes": [
        {
          "kind": "postgres",
          "resource": "announcements",
          "actions": [
            "delete"
          ]
        }
      ],
      "dependencies": [
        {
          "kind": "postgres",
          "name": "primary"
        }
      ],
      "consumers": [
        {
          "kind": "admin-web",
          "name": "admin-frontend"
        }
      ],
      "events": [],
      "acceptance_test_ids": [
        "API-01",
        "OWN-01"
      ],
      "evidence": [
        "tests/api/test_04_catalog_reads.py"
      ]
    },
    {
      "operation": "catalog.delete.api-catalog-admin-editor-picks-id",
      "method": "DELETE",
      "path": "/api/catalog/admin/editor-picks/{id}",
      "lifecycle": "current",
      "access_plane": "admin",
      "owner": "catalog",
      "handler": "services/catalog_go/internal/httpapi/api.go:a.deleteEditorPick",
      "version": "v1",
      "authentication": {
        "mode": "admin-session",
        "principal": "admin",
        "required_role": "admin",
        "credential_scope": null
      },
      "permitted_writes": [
        {
          "kind": "postgres",
          "resource": "editor_picks",
          "actions": [
            "delete"
          ]
        }
      ],
      "dependencies": [
        {
          "kind": "postgres",
          "name": "primary"
        }
      ],
      "consumers": [
        {
          "kind": "admin-web",
          "name": "admin-frontend"
        }
      ],
      "events": [],
      "acceptance_test_ids": [
        "API-01",
        "OWN-01"
      ],
      "evidence": [
        "tests/api/test_04_catalog_reads.py"
      ]
    },
    {
      "operation": "catalog.delete.api-catalog-series-seriesid",
      "method": "DELETE",
      "path": "/api/catalog/series/{seriesID}",
      "lifecycle": "current",
      "access_plane": "admin",
      "owner": "catalog",
      "handler": "services/catalog_go/internal/httpapi/api.go:a.deleteSeries",
      "version": "v1",
      "authentication": {
        "mode": "admin-session",
        "principal": "admin",
        "required_role": "admin",
        "credential_scope": null
      },
      "permitted_writes": [
        {
          "kind": "postgres",
          "resource": "series",
          "actions": [
            "delete"
          ]
        }
      ],
      "dependencies": [
        {
          "kind": "postgres",
          "name": "primary"
        }
      ],
      "consumers": [
        {
          "kind": "admin-web",
          "name": "admin-frontend"
        }
      ],
      "events": [],
      "acceptance_test_ids": [
        "API-01",
        "OWN-01"
      ],
      "evidence": [
        "tests/api/test_04_catalog_reads.py"
      ]
    },
    {
      "operation": "catalog.delete.api-catalog-series-seriesid-chapters-chapterid",
      "method": "DELETE",
      "path": "/api/catalog/series/{seriesID}/chapters/{chapterID}",
      "lifecycle": "current",
      "access_plane": "admin",
      "owner": "catalog",
      "handler": "services/catalog_go/internal/httpapi/api.go:a.deleteChapter",
      "version": "v1",
      "authentication": {
        "mode": "admin-session",
        "principal": "admin",
        "required_role": "admin",
        "credential_scope": null
      },
      "permitted_writes": [
        {
          "kind": "postgres",
          "resource": "chapters",
          "actions": [
            "delete"
          ]
        }
      ],
      "dependencies": [
        {
          "kind": "postgres",
          "name": "primary"
        }
      ],
      "consumers": [
        {
          "kind": "admin-web",
          "name": "admin-frontend"
        }
      ],
      "events": [],
      "acceptance_test_ids": [
        "API-01",
        "OWN-01"
      ],
      "evidence": [
        "tests/api/test_04_catalog_reads.py"
      ]
    },
    {
      "operation": "scraper.delete.api-scraper-drafts-draft-id-pages-page-id",
      "method": "DELETE",
      "path": "/api/scraper/drafts/{draft_id}/pages/{page_id}",
      "lifecycle": "current",
      "access_plane": "admin",
      "owner": "scraper",
      "handler": "services/scraper_service/app/main.py:scraper_draft_remove_page",
      "version": "v1",
      "authentication": {
        "mode": "admin-session",
        "principal": "admin",
        "required_role": "admin",
        "credential_scope": null
      },
      "permitted_writes": [
        {
          "kind": "postgres",
          "resource": "scraper_drafts",
          "actions": [
            "insert",
            "update",
            "delete"
          ]
        },
        {
          "kind": "filesystem",
          "resource": "scraper-staging",
          "actions": [
            "write"
          ]
        }
      ],
      "dependencies": [
        {
          "kind": "postgres",
          "name": "primary"
        },
        {
          "kind": "filesystem",
          "name": "local-staging"
        }
      ],
      "consumers": [
        {
          "kind": "admin-web",
          "name": "admin-frontend"
        }
      ],
      "events": [],
      "acceptance_test_ids": [
        "API-01",
        "OWN-01"
      ],
      "evidence": [
        "tests/api/test_24_deep_route_coverage.py"
      ]
    },
    {
      "operation": "scraper.delete.api-scraper-operations-draft-id",
      "method": "DELETE",
      "path": "/api/scraper/operations/{draft_id}",
      "lifecycle": "current",
      "access_plane": "admin",
      "owner": "scraper",
      "handler": "services/scraper_service/app/main.py:scraper_cancel_operation",
      "version": "v1",
      "authentication": {
        "mode": "admin-session",
        "principal": "admin",
        "required_role": "admin",
        "credential_scope": null
      },
      "permitted_writes": [
        {
          "kind": "postgres",
          "resource": "ingestion_operations",
          "actions": [
            "update"
          ]
        }
      ],
      "dependencies": [
        {
          "kind": "postgres",
          "name": "primary"
        }
      ],
      "consumers": [
        {
          "kind": "admin-web",
          "name": "admin-frontend"
        }
      ],
      "events": [],
      "acceptance_test_ids": [
        "API-01",
        "OWN-01"
      ],
      "evidence": [
        "tests/api/test_18_scraper_operations.py"
      ]
    },
    {
      "operation": "scraper.delete.api-scraper-series-drafts-chapters-chapter-id-pages-page-id",
      "method": "DELETE",
      "path": "/api/scraper/series-drafts/chapters/{chapter_id}/pages/{page_id}",
      "lifecycle": "current",
      "access_plane": "admin",
      "owner": "scraper",
      "handler": "services/scraper_service/app/main.py:scraper_series_draft_remove_page",
      "version": "v1",
      "authentication": {
        "mode": "admin-session",
        "principal": "admin",
        "required_role": "admin",
        "credential_scope": null
      },
      "permitted_writes": [
        {
          "kind": "postgres",
          "resource": "scraper_series_drafts",
          "actions": [
            "insert",
            "update",
            "delete"
          ]
        },
        {
          "kind": "filesystem",
          "resource": "scraper-staging",
          "actions": [
            "write"
          ]
        }
      ],
      "dependencies": [
        {
          "kind": "postgres",
          "name": "primary"
        },
        {
          "kind": "filesystem",
          "name": "local-staging"
        }
      ],
      "consumers": [
        {
          "kind": "admin-web",
          "name": "admin-frontend"
        }
      ],
      "events": [],
      "acceptance_test_ids": [
        "API-01",
        "OWN-01"
      ],
      "evidence": [
        "tests/api/test_15_scraper_new_series.py"
      ]
    },
    {
      "operation": "scraper.delete.api-scraper-series-drafts-draft-id-cover",
      "method": "DELETE",
      "path": "/api/scraper/series-drafts/{draft_id}/cover",
      "lifecycle": "current",
      "access_plane": "admin",
      "owner": "scraper",
      "handler": "services/scraper_service/app/main.py:scraper_series_cover_remove",
      "version": "v1",
      "authentication": {
        "mode": "admin-session",
        "principal": "admin",
        "required_role": "admin",
        "credential_scope": null
      },
      "permitted_writes": [
        {
          "kind": "postgres",
          "resource": "scraper_series_drafts",
          "actions": [
            "insert",
            "update",
            "delete"
          ]
        },
        {
          "kind": "filesystem",
          "resource": "scraper-staging",
          "actions": [
            "write"
          ]
        }
      ],
      "dependencies": [
        {
          "kind": "postgres",
          "name": "primary"
        },
        {
          "kind": "filesystem",
          "name": "local-staging"
        }
      ],
      "consumers": [
        {
          "kind": "admin-web",
          "name": "admin-frontend"
        }
      ],
      "events": [],
      "acceptance_test_ids": [
        "API-01",
        "OWN-01"
      ],
      "evidence": [